{
  "meta": {
    "id": "art_sample_design_system_asset",
    "type": "design-system-asset",
    "schemaVersion": "1.0.0",
    "revision": 1,
    "title": "Sample design-system-asset",
    "createdAt": "2026-10-05T17:00:00Z"
  },
  "scope": {
    "level": "product",
    "ownerId": "product_mimic",
    "parentId": "org_9uile"
  },
  "lifecycle": {
    "status": "provisional",
    "freshness": "valid"
  },
  "origin": {
    "actorKind": "agent",
    "actorId": "agent_designer",
    "runId": "run_123",
    "createdAt": "2026-10-05T17:00:00Z"
  },
  "dependencies": [],
  "approval": {
    "status": "pending"
  },
  "provenance": [
    {
      "path": "/content",
      "kind": "assumption",
      "rationale": "Initial design hypothesis; requires review."
    }
  ],
  "content": {
    "summary": "Illustrative provisional design-system-asset.",
    "assetKind": "pattern",
    "name": "Candidate comparison",
    "definition": {
      "intent": "Compare alternatives"
    },
    "usageRules": ["Use for two or more candidates"],
    "antiUsageRules": ["Do not imply approval"]
  }
}
