{
  "meta": {
    "id": "art_s01_product_definition",
    "type": "product-definition",
    "schemaVersion": "1.0.0",
    "revision": 1,
    "title": "Product Definition candidate",
    "createdAt": "2026-10-05T17:00:00Z"
  },
  "scope": {
    "level": "product",
    "ownerId": "product_mimic",
    "parentId": "org_9uile"
  },
  "lifecycle": {
    "status": "provisional",
    "freshness": "valid"
  },
  "origin": {
    "actorKind": "skill",
    "actorId": "mimic.s01.product-definition",
    "runId": "run_s01_s07_example",
    "createdAt": "2026-10-06T12:00:00Z"
  },
  "dependencies": [],
  "approval": {
    "status": "pending"
  },
  "provenance": [
    {
      "path": "/content",
      "kind": "assumption",
      "rationale": "Illustrative provisional candidate; no empirical research is claimed."
    }
  ],
  "content": {
    "summary": "A provisional definition of a design decision service.",
    "vision": "Make product design decisions traceable.",
    "goals": [
      "Produce a versioned Design Package",
      "Expose decision provenance"
    ],
    "nonGoals": ["Generate a production application"]
  }
}
