{
  "meta": {
    "id": "art_s10_choice",
    "type": "decision",
    "schemaVersion": "1.0.0",
    "revision": 1,
    "title": "Incident direction choice",
    "createdAt": "2026-10-06T12:00:00Z"
  },
  "scope": {
    "level": "product",
    "ownerId": "product_mimic",
    "parentId": "org_9uile"
  },
  "lifecycle": { "status": "proposed", "freshness": "valid" },
  "origin": {
    "actorKind": "skill",
    "actorId": "mimic.s10.design-direction-generator",
    "runId": "run_s10_example",
    "createdAt": "2026-10-06T12:00:00Z"
  },
  "dependencies": [],
  "approval": { "status": "pending" },
  "content": {
    "summary": "Owner review of structural directions is pending.",
    "question": "Which incident handoff structure should be adopted?",
    "alternatives": [
      "Timeline",
      "Queue",
      "Map",
      "Guided checkpoints",
      "Return to divergence"
    ],
    "outcome": "proposed",
    "rationale": "The structural comparison is a proposal; capability and behavioral assumptions still require validation."
  },
  "provenance": [
    {
      "path": "/content/alternatives",
      "kind": "derived",
      "inputRefs": ["art_profile@1", "art_contract@1", "art_selection@1"],
      "rationale": "Candidate set generated from bounded task, contract and mechanisms; no candidate is selected."
    }
  ]
}
