{
  "meta": {
    "id": "art_sample_experience_domain",
    "type": "experience-domain",
    "schemaVersion": "1.0.0",
    "revision": 1,
    "title": "Sample experience-domain",
    "createdAt": "2026-10-05T17:00:00Z"
  },
  "scope": {
    "level": "product",
    "ownerId": "product_mimic",
    "parentId": "org_9uile"
  },
  "lifecycle": {
    "status": "provisional",
    "freshness": "valid"
  },
  "origin": {
    "actorKind": "agent",
    "actorId": "agent_designer",
    "runId": "run_123",
    "createdAt": "2026-10-05T17:00:00Z"
  },
  "dependencies": [],
  "approval": {
    "status": "pending"
  },
  "provenance": [
    {
      "path": "/content",
      "kind": "assumption",
      "rationale": "Initial design hypothesis; requires review."
    }
  ],
  "content": {
    "summary": "Illustrative provisional experience-domain.",
    "primaryGoal": "Inspect design evidence",
    "interactionModel": "Browse and compare",
    "informationStructure": "Artifacts grouped by domain",
    "temporalBehavior": "Revisions over time",
    "riskModel": "Do not confuse provisional and approved",
    "sessionModel": "Resume a review"
  }
}
