{
  "meta": {
    "id": "art_reference_01",
    "type": "reference-selection",
    "schemaVersion": "1.0.0",
    "revision": 1,
    "title": "Navigation contract",
    "createdAt": "2026-10-05T17:00:00Z"
  },
  "scope": {
    "level": "product",
    "ownerId": "product_mimic",
    "parentId": "org_9uile"
  },
  "lifecycle": {
    "status": "proposed",
    "freshness": "valid"
  },
  "origin": {
    "actorKind": "agent",
    "actorId": "agent_designer",
    "runId": "run_123",
    "createdAt": "2026-10-05T17:00:00Z"
  },
  "dependencies": [],
  "approval": {
    "status": "pending"
  },
  "provenance": [
    {
      "path": "/content",
      "kind": "assumption",
      "rationale": "Initial design hypothesis; requires review."
    }
  ],
  "content": {
    "summary": "Structurally relevant distant case.",
    "references": [
      {
        "reference": "Case A",
        "classification": "far",
        "structuralRelevance": "high",
        "contextDistance": "high",
        "transferableMechanisms": [
          "Progressive disclosure"
        ]
      }
    ]
  }
}
