{
  "meta": {
    "id": "art_s05_ui_contract_manager",
    "type": "product-ui-contract",
    "schemaVersion": "1.0.0",
    "revision": 1,
    "title": "UI Contract Manager candidate",
    "createdAt": "2026-10-05T17:00:00Z"
  },
  "scope": {
    "level": "product",
    "ownerId": "product_mimic",
    "parentId": "org_9uile"
  },
  "lifecycle": {
    "status": "provisional",
    "freshness": "valid"
  },
  "origin": {
    "actorKind": "skill",
    "actorId": "mimic.s05.ui-contract-manager",
    "runId": "run_s01_s07_example",
    "createdAt": "2026-10-06T12:00:00Z"
  },
  "dependencies": [],
  "approval": {
    "status": "pending"
  },
  "provenance": [
    {
      "path": "/content/entityContext/0",
      "kind": "fact",
      "evidenceRefs": [
        "skills/s04-system-capability-extractor/evidence/system-response.json"
      ]
    },
    {
      "path": "/content/navigation/0",
      "kind": "assumption",
      "rationale": "Task-driven requirement; requires human product review."
    },
    {
      "path": "/content/terminology/0",
      "kind": "assumption",
      "rationale": "Task wording proposed for review."
    },
    {
      "path": "/content/terminology/1",
      "kind": "assumption",
      "rationale": "Task wording proposed for review."
    },
    {
      "path": "/content/entityContext/1",
      "kind": "hypothesis",
      "rationale": "Persistence is a proposed change, not current system behavior."
    },
    {
      "path": "/content/entityContext/2",
      "kind": "unknown",
      "rationale": "No supplied evidence defines review_state approval semantics."
    }
  ],
  "content": {
    "summary": "One shared contract for candidate review across entry modes.",
    "navigation": [
      "Required: return to candidate review with candidate ID and a visible return path."
    ],
    "terminology": [
      "Required: use Candidate for the reviewed entity.",
      "Required: use Evidence for supporting material."
    ],
    "entityContext": [
      "Current: response contains review_state key for a requested review.",
      "Proposed: restore candidate review state across sessions.",
      "Unresolved: approval semantics of review_state are unknown."
    ],
    "accessibilityBaseline": "WCAG 2.2 AA"
  }
}
